{
  "version": "1.0.0",
  "generated": "2026-08-20",
  "stats": {
    "total_skills": 41,
    "public_skills": 31,
    "deprecated_skills": 0,
    "active_public_skills": 31,
    "commands": 20,
    "agents": 11,
    "micro_skills": 7,
    "orchestrators": 3,
    "helpers": 0,
    "plugins": 4
  },
  "repos": [
    {
      "repo": "rpatrik96/research-agora",
      "description": "Research Agora - ML research skills marketplace",
      "homepage": "https://rpatrik96.github.io/research-agora",
      "skills": [
        {
          "name": "brainstorm",
          "plugin": "discover",
          "type": "command",
          "description": "Checkpoint-gated interactive brainstorming for research and knowledge-organization\ndecisions: framing a problem, exploring the option space, and choosing a direction\nWITH the user rather than for them. Use when asked to \"brainstorm\", \"think through\noptions\", \"explore approaches\", \"help me decide\", \"what's the best way to\nstructure/represent/organize X\", \"weigh alternatives\", \"design a study/benchmark/\ntaxonomy\", or when a task's hardest part is a decision the user must own.\nSupports optional multi-agent debate (opposing-prior proposers + a fact-checking\ndevil's advocate) between checkpoints. For software-implementation design and specs,\ndefer to superpowers:brainstorming if that plugin is installed \u2014 this skill owns\nresearch and representation decisions, not code architecture.",
          "model": "opus",
          "path": "plugins/discover/commands/brainstorm.md",
          "research-domain": "general",
          "task-type": "analysis",
          "research-phase": "ideation",
          "verification-level": "heuristic",
          "visibility": "public"
        },
        {
          "name": "navigator",
          "plugin": "discover",
          "type": "command",
          "description": "Find the right skill, or find out what changed. Use when asked \"which skill\nshould I use\", \"what skill do I need\", \"recommend a skill\", \"what can the\nAgora do for\", \"what should I run first\", \"quick start\", \"give me a demo\",\n\"get me started\", \"what's new\", \"what changed since I last used this\",\n\"catch me up\", or \"changelog\". Three modes: **route** maps a task description\nto a skill, **start** scans the current directory and picks the single\nhighest-value thing to run right now, **changes** reports what was added,\ndeprecated and removed since a date.",
          "model": "sonnet",
          "path": "plugins/discover/commands/navigator.md",
          "research-domain": "general",
          "task-type": "analysis",
          "research-phase": "implementation",
          "verification-level": "none",
          "visibility": "public"
        },
        {
          "name": "onboard",
          "plugin": "discover",
          "type": "command",
          "description": "Personalized Research Agora setup via scripts/onboard.py",
          "model": "haiku",
          "path": "plugins/discover/commands/onboard.md",
          "research-domain": "general",
          "task-type": "automation",
          "research-phase": "implementation",
          "verification-level": "none",
          "visibility": "public"
        },
        {
          "name": "novelty-checker",
          "plugin": "discover",
          "type": "micro-skill",
          "description": "Verify novelty claims by searching arXiv for prior/concurrent work.\nUses batch queries for efficiency. Trigger: \"check novelty claim\",\n\"verify novelty\", \"search for prior work\".",
          "model": "sonnet",
          "path": "plugins/discover/micro-skills/novelty-checker.md",
          "research-domain": "general",
          "task-type": "verification",
          "research-phase": "paper-writing",
          "verification-level": "heuristic",
          "visibility": "internal"
        },
        {
          "name": "agora-feedback",
          "plugin": "toolkit",
          "type": "command",
          "description": "Opt-in, review-gated usage feedback for Research Agora skills (RFC-0001).\nUse when asked to \"enable agora feedback\", \"share skill feedback\",\n\"show my skill usage stats\", \"submit agora feedback\", \"report skill usage\",\n\"disable feedback capture\", or \"purge my feedback spool\".\nNothing is ever sent without the user reviewing the exact payload and\nexplicitly confirming.",
          "model": "sonnet",
          "path": "plugins/toolkit/commands/agora-feedback.md",
          "research-domain": "general",
          "task-type": "automation",
          "research-phase": "implementation",
          "verification-level": "heuristic",
          "visibility": "public"
        },
        {
          "name": "audit-my-setup",
          "plugin": "toolkit",
          "type": "command",
          "description": "Health check for the user's Research Agora configuration. Reads CLAUDE.md files,\nchecks installed plugins, MCP servers, hooks, and privacy settings.\nUse when asked to \"audit my setup\", \"check my configuration\", \"am I set up correctly\",\n\"health check my Agora\", \"what am I missing\", \"how mature is my setup\",\n\"review my CLAUDE.md\", \"is my configuration good\", or \"help me level up my config\".\nProduces a scored health report with specific, actionable recommendations.",
          "model": "sonnet",
          "path": "plugins/toolkit/commands/audit-my-setup.md",
          "research-domain": "general",
          "task-type": "analysis",
          "research-phase": "implementation",
          "verification-level": "heuristic",
          "visibility": "public"
        },
        {
          "name": "code-simplify",
          "plugin": "toolkit",
          "type": "command",
          "description": "Analyze and refactor Python codebases to remove dead code, eliminate duplication, and simplify complexity. Use when asked to \"simplify code\", \"remove dead code\", \"find duplicates\", \"refactor\", \"clean up codebase\", or \"reduce complexity\".",
          "model": "sonnet",
          "path": "plugins/toolkit/commands/code-simplify.md",
          "research-domain": "general",
          "task-type": "analysis",
          "research-phase": "implementation",
          "verification-level": "layered",
          "visibility": "public"
        },
        {
          "name": "experiment-tracker",
          "plugin": "toolkit",
          "type": "command",
          "description": "Sync ML experiment results to paper drafts. Use when asked to \"update results\",\n\"sync experiments\", \"pull latest metrics\", \"update tables from code\",\n\"experiment to paper\", \"refresh results\", or \"sync paper with repo\".\nExtracts metrics from code/logs and updates paper sections.",
          "model": "sonnet",
          "path": "plugins/toolkit/commands/experiment-tracker.md",
          "research-domain": "general",
          "task-type": "automation",
          "research-phase": "experiment-design",
          "verification-level": "none",
          "visibility": "public"
        },
        {
          "name": "figures",
          "plugin": "toolkit",
          "type": "command",
          "description": "Make publication figures for ML papers, in TikZ or matplotlib. Use when asked\nto \"create a figure\", \"make a plot\", \"visualize results\", \"draw a neural\nnetwork\", \"make a diagram in LaTeX\", \"TikZ flowchart\", \"architecture diagram\",\n\"publication figure\", \"style matplotlib\", or \"format figures for a\nconference\". **tikz** draws diagrams whose content you describe; **plot**\nrenders data you supply, read from real files rather than invented.",
          "model": "sonnet",
          "path": "plugins/toolkit/commands/figures.md",
          "research-domain": "general",
          "task-type": "formatting",
          "research-phase": "paper-writing",
          "verification-level": "none",
          "visibility": "public"
        },
        {
          "name": "htcondor",
          "plugin": "toolkit",
          "type": "command",
          "description": "Generate HTCondor submission files and wrapper scripts for ML research jobs.\nUse when asked to \"create condor job\", \"submit to cluster\", \"write .sub file\",\n\"htcondor setup\", \"cluster job\", or \"batch submission\". Supports GPU/CPU jobs,\nparameter sweeps, multi-seed experiments, and ablation studies.",
          "model": "sonnet",
          "path": "plugins/toolkit/commands/htcondor.md",
          "research-domain": "general",
          "task-type": "automation",
          "research-phase": "implementation",
          "verification-level": "none",
          "visibility": "public"
        },
        {
          "name": "latex-sync",
          "plugin": "toolkit",
          "type": "command",
          "description": "Keep a paper's equations and the code implementing them in agreement, via the\nlatex-code-sync CLI. Use when asked to \"set up latex-code-sync\", \"link\nequations to code\", \"annotate functions with equations\", \"verify equations\nmatch code\", \"check the paper against the implementation\", or \"does my code\nmatch my math\". Three modes of one workflow: **setup** bootstraps the package\nand CI, **annotate** links functions to equations with decorators, **verify**\nruns the checker and reports mismatches.",
          "model": "sonnet",
          "path": "plugins/toolkit/commands/latex-sync.md",
          "research-domain": "general",
          "task-type": "verification",
          "research-phase": "implementation",
          "verification-level": "formal",
          "visibility": "public"
        },
        {
          "name": "latex",
          "plugin": "toolkit",
          "type": "command",